{
  "schema_version": "1.0",
  "template_id": "vc_founder_dossier_v1",
  "language": "ru",
  "deck": {
    "title": "Досье стартапа для фонда",
    "subtitle": "Интервью с фаундером → структурированное досье",
    "assistant_name": "Sevinch",
    "prepared_for": {
      "fund_name": "United Ventures",
      "recipient_role": "инвестиционная команда"
    },
    "prepared_at": "2026-06-17"
  },
  "startup": {
    "name": "MaktabAI",
    "industry": "EdTech",
    "stage": "MVP + платящие школы",
    "one_line": "AI-репетитор по школьной программе на узбекском и русском языках.",
    "location": "Узбекистан"
  },
  "founder": {
    "full_name": "Жасур Каримов",
    "role": "фаундер",
    "background_short": "Бывший учитель и методист, имеет контакты в управлениях образования.",
    "founder_strength": "Глубоко понимает школьную среду, умеет говорить с администрациями школ и быстро получает доступ к пилотам."
  },
  "business": {
    "essence": "AI-репетитор по школьной программе на узбекском и русском языках.",
    "customer": "Частные школы и родители.",
    "payer": "Основной плательщик — школа. Модель B2B2C.",
    "business_model": "Подписка для школ за доступ учеников к AI-репетитору.",
    "traction": {
      "summary": "8 школ, 1200 учеников, около $3.5K MRR, команда 5 человек.",
      "schools_count": 8,
      "users_count": 1200,
      "monthly_revenue_usd": 3500,
      "team_size": 5
    }
  },
  "assessment": {
    "status": {
      "code": "ready_for_committee",
      "label": "Готов к комитету",
      "icon": "✓",
      "tone": "positive"
    },
    "readiness": {
      "level": "high",
      "title": "Высокая.",
      "comment": "Есть спрос, выручка и понятная поддержка EdTech-рынка."
    },
    "risks": [
      "Сезонность учебного года.",
      "Зависимость от одной сети школ.",
      "Нужно подтвердить удержание после первых пилотов."
    ],
    "red_flags": [
      {
        "level": "medium",
        "text": "Существенная часть текущей выручки может зависеть от ограниченного числа школ."
      }
    ],
    "positive_signals": [
      "Есть платящие школы.",
      "Фаундер имеет релевантный опыт в образовании.",
      "Продукт уже используется учениками, а не существует только в виде идеи."
    ],
    "unknowns": [
      "CAC и стоимость продаж в школы.",
      "Retention учеников и школ после первого учебного периода.",
      "Юнит-экономика при масштабировании в регионы."
    ]
  },
  "recommendation": {
    "headline": "Брать на разговор.",
    "comment": "Чек — на масштабирование по регионам.",
    "next_steps": [
      "Проверить концентрацию выручки по школам.",
      "Запросить когорты использования учениками.",
      "Посмотреть договоры или письма о намерениях от школ.",
      "Проверить план регионального масштабирования."
    ]
  },
  "slide_copy": {
    "kicker": "ПРИМЕР ДОСЬЕ · КАРТИНА ЧЁТКАЯ",
    "title": "MaktabAI",
    "subtitle": "Жасур Каримов · EdTech · MVP + платящие школы",
    "sections": {
      "essence": {
        "title": "СУТЬ",
        "body": "AI-репетитор по школьной программе на узб/рус."
      },
      "payer": {
        "title": "КТО ПЛАТИТ",
        "body": "Частные школы и родители.\nПлатит школа (B2B2C)."
      },
      "traction": {
        "title": "ТРЕКШН",
        "body": "8 школ, 1200 учеников, ~$3.5K/мес, команда 5."
      },
      "founder_strength": {
        "title": "СИЛА ФАУНДЕРА",
        "body": "Экс-учитель + методист, контакт с управлениями образования."
      },
      "risks": {
        "title": "🚩 РИСКИ",
        "body": "Сезонность учебного года.\nЗависимость от одной сети школ."
      },
      "readiness": {
        "title": "ГОТОВНОСТЬ",
        "body": "Высокая.\nСпрос, выручка, поддержка EdTech."
      },
      "fund_note": {
        "title": "SEVINCH → ФОНДУ",
        "body": "Брать на разговор.\nЧек — на масштабирование по регионам."
      }
    }
  },
  "audit": {
    "confidence": "medium",
    "needs_human_review": true,
    "reason": "Часть выводов основана на словах фаундера и требует проверки документами.",
    "source_type": "founder_interview",
    "evidence": [
      {
        "field": "business.traction.monthly_revenue_usd",
        "source": "founder_statement",
        "quote": "Сейчас около трех с половиной тысяч долларов в месяц."
      },
      {
        "field": "business.traction.schools_count",
        "source": "founder_statement",
        "quote": "С нами работают восемь частных школ."
      }
    ]
  }
}